{
	"schema":	"design-snapshot.v1",
	"generator":	"physics-synthesis-compiler",
	"generator_version":	"0.1.0",
	"topology":	"ldo_3v3",
	"components":	[{
			"role":	"U1",
			"refdes":	"U1",
			"mpn":	"DEMO-LDO-3V3-SOT23",
			"value":	3.3,
			"package":	"SOT-23",
			"qty":	1
		}, {
			"role":	"C1",
			"refdes":	"C1",
			"mpn":	"DEMO-100N-0603-A",
			"value":	1e-07,
			"package":	"0603",
			"qty":	1
		}],
	"nets":	[{
			"name":	"VIN",
			"pins":	["U1.VIN"]
		}, {
			"name":	"3V3",
			"pins":	["U1.VOUT", "C1.1"]
		}, {
			"name":	"GND",
			"pins":	["U1.GND", "C1.2"]
		}]
}
