{
	"schema":	"design-snapshot.v1",
	"generator":	"physics-synthesis-compiler",
	"generator_version":	"0.1.0",
	"topology":	"usb_c_stm32_composed",
	"components":	[{
			"role":	"usb_c_sink_cc",
			"refdes":	"usb_c_sink_cc",
			"mpn":	"DEMO-5K1-0603-A",
			"value":	5100,
			"package":	"0603",
			"qty":	1
		}, {
			"role":	"ldo_5v_fb",
			"refdes":	"ldo_5v_fb",
			"mpn":	"DEMO-10K-0603-A",
			"value":	10000,
			"package":	"0603",
			"qty":	1
		}, {
			"role":	"mcu_min_system_pu",
			"refdes":	"mcu_min_system_pu",
			"mpn":	"DEMO-10K-0603-A",
			"value":	10000,
			"package":	"0603",
			"qty":	1
		}, {
			"role":	"i2c_temp_sensor_pull",
			"refdes":	"i2c_temp_sensor_pull",
			"mpn":	"DEMO-4K7-0603-A",
			"value":	4700,
			"package":	"0603",
			"qty":	1
		}, {
			"role":	"status_led_rled",
			"refdes":	"status_led_rled",
			"mpn":	"DEMO-330-0603-A",
			"value":	330,
			"package":	"0603",
			"qty":	1
		}],
	"nets":	[{
			"name":	"VBUS",
			"pins":	["usb_c_sink_cc.1", "ldo_5v_fb.1"]
		}, {
			"name":	"GND",
			"pins":	["usb_c_sink_cc.2", "mcu_min_system_pu.2", "i2c_temp_sensor_pull.2", "status_led_rled.2"]
		}, {
			"name":	"3V3",
			"pins":	["ldo_5v_fb.2", "mcu_min_system_pu.1", "i2c_temp_sensor_pull.1", "status_led_rled.1"]
		}]
}
