{
	"schema":	"design-snapshot.v1",
	"generator":	"physics-synthesis-compiler",
	"generator_version":	"0.1.0",
	"topology":	"led_series_indicator",
	"components":	[{
			"role":	"R1",
			"refdes":	"R1",
			"mpn":	"DEMO-330-0603-A",
			"value":	330,
			"package":	"0603",
			"qty":	1
		}, {
			"role":	"D1",
			"refdes":	"D1",
			"mpn":	"DEMO-LED-RED-0603-A",
			"value":	2,
			"package":	"0603",
			"qty":	1
		}],
	"nets":	[{
			"name":	"5V",
			"pins":	["R1.1"]
		}, {
			"name":	"LED_A",
			"pins":	["R1.2", "D1.1"]
		}, {
			"name":	"GND",
			"pins":	["D1.2"]
		}]
}
