{
	"schema":	"design-snapshot.v1",
	"generator":	"physics-synthesis-compiler",
	"generator_version":	"0.1.0",
	"topology":	"rl_low_pass_filter",
	"components":	[{
			"role":	"R1",
			"refdes":	"R1",
			"mpn":	"DEMO-10K-0603-A",
			"value":	10000,
			"package":	"0603",
			"qty":	1
		}, {
			"role":	"L1",
			"refdes":	"L1",
			"mpn":	"DEMO-10U-0603-A",
			"value":	1e-05,
			"package":	"0603",
			"qty":	1
		}],
	"nets":	[{
			"name":	"VIN",
			"pins":	["R1.1"]
		}, {
			"name":	"VOUT",
			"pins":	["R1.2", "L1.1"]
		}, {
			"name":	"GND",
			"pins":	["L1.2"]
		}]
}
